job_id,source_job_id,name,description_short,description,how_to_get,working_conditions,source_url,source_file,source_version,source_published_on
JT0504,504,稲作農業者,水田で稲を栽培し、米を収穫して出荷する。,水田で稲を栽培し、米を収穫して出荷する。 日本の稲作は田んぼに水を張り、苗を植えて育てる「水田稲作」がほとんどである。苗づくりや水田・稲穂の管理など、季節や天候に合わせた細やかな栽培管理が必要である。 稲作農業者は自ら経営者を兼ねて家族農業経営の形をとっていることが多く、生産のみならず経営・販売など幅広い仕事を行う。 水田で米を作るための具体的な作業としては、水田の耕起（こうき）、育苗（いくびょう）、田植、施肥（せひ）、病害虫防除、除草、水管理、収穫、乾燥、調整などがある。かつてはこれらの作業のほとんどを手作業で行っていたが、現在では稲作技術が進歩し、水田を耕すトラクター、苗を植える田植機、農薬散布のための防除機、収穫のためのコンバインなどの機械が導入され、重労働は少なくなっている。 稲作作業は東北・北陸地方の北日本では、冬は雪で農業が困難なため、この間に他の仕事に就いている人もいる。一方、関東地方より南西では、比較的暖かい気候のため、夏に稲作、冬に裏作として野菜を生産する二毛作が行なうところが多い。また、土づくりや苗づくりから防除、稲刈り、もみすり、出荷までの仕事を地域で共同で能率よく行う取り組みもある。 機械化に伴い、稲作の大規模経営化も進んでいるが、その一方で、米の生産過剰、消費量の減少、価格の低迷などから、経営を安定させるため、大豆・麦・そば・野菜・花きなどを栽培し、米以外からの収入を確保する動きも見られる。 ◇ よく使う道具、機材、情報技術等 トラクター、田植機、防除機、コンバイン、軽トラック、普通自動車,入職にあたって、特に学歴や資格は必要とされない。稲作には水田や農業機械などの大規模な経営資産が必要となるため、親や親戚などから資産を引き継いで就業する場合と、新規に就農する場合では条件が大きく異なる。特に、農家以外の人は、農地（水田等）の購入ができないため、多くは借地で始めている。一方で、これまで米生産を担ってきた生産者の高齢化が進み、後継者がいない水田は借地や作業委託という形で地域の特定の生産者に集積され、経営規模が拡大する傾向にある。 新規に就農しようとする場合は、相当の設備投資が必要になるため、「全国新規就農相談センター」では、農業に興味がある人のために農地・家屋情報や求人情報などを提供し、バックアップをしている。 稲作の基本的な知識や技術は、各農業法人が提供するインターンシップ制度を利用したり、農業高校や農業大学校、就農準備校などで稲作の技術と経営に関する研修を受けて身につけることができる。アルバイトを募集している農家で米作りの作業をし、稲作の技術と経営に関する知識を身に付ける方法もある。 稲作と他の作物との小規模な複合経営からはじめ、規模を拡大して稲作だけで安定した収入が得られるようになるには、少なくとも数年はかかる。 経営者となるには、米作りの専門知識と技術のほかに、経営管理能力も必要となる。 トラクターや軽トラックなどの運転のため「普通自動車免許」「大型特殊自動車免許」を取得していると有益である。,基幹的農業従事者は約111.4万人であり、その平均年齢は69.2歳となっている（2024年時点*1）。 水稲作付農家のうち、主業農家は2割弱でその他の大多数は農業以外の仕事で働きながら稲作を行う兼業農家である（2020年時点*2）。稲の生育には、大雨や台風、異常気象などに対応した管理作業や、病気の予察・防除など、常に気を配らなければならず、決まった労働時間だけで対応できないことも多い。一方で、4月～10月の農繁期は農作業の進み具合に合わせて自分で休日を設定し、11月～3月の農閑期には、他の仕事をしながら自由に休暇を設定できるという利点もある。従来、稲作農業者の後継ぎはほぼ100％が農家出身者であったが、最近では、非農家の人が新規に稲作経営を開始できるようになっている。稲作農業生産法人（会社）への就業や、農村に移り住み、水田を借地契約して米づくりを始める例が見られる。コメ作りは機械化が進み作業が軽減されており、広い農地が確保できれば、安定した収入が得られる。 米は品種改良が盛んで、毎年様々な「新種米」が市場に出回り、生産者が独自ブランドを確立している。インターネットでの直接販売の方法も増えてきている。 *1 農林水産省 「農業労働力に関する統計」から *2 農林水産省「稲作の現状とその課題について」農家数の推移から,https://shigoto.mhlw.go.jp/User/download,IPD_DL_description_7_01.csv,7.01,2026-06-04
JT0505,505,ハウス野菜栽培者,様々な種類の野菜を、露地での生産ではなく、気象条件の影響を受けにくいガラス温室やビニールハウスなどの施設で生産する。,様々な種類の野菜を、露地での生産ではなく、気象条件の影響を受けにくいガラス温室やビニールハウスなどの施設で生産する。 この生産方法を包括して「施設園芸」と呼んでいる。「施設園芸」には、花、果実、野菜等の生産が含まれるが、ここではハウス野菜栽培について記述する。 ハウス野菜栽培者は経営者を兼ねている場合が多い。まず、畑となる土地、施設、農機具などを整備して、生産品目を決め、生産量や出荷時期といった経営計画を立てる。特に出荷時期の選択が重要な野菜の場合には、どの時期にどの程度の人手と資金を投入すれば良いかの判断が重要である。 実際の栽培の仕事には、土作り、肥料やり、種まき、育苗（いくびょう）、植付け、病害虫の防除、除草、収穫、出荷といった多くの作業がある。まず、土地に堆肥や肥料を入れ、畑を耕して野菜が育ちやすい土壌を作る。そこに畝（うね）を立て、種子をまくか苗を植え、生育に適した温度、潅水（かんすい）、病害虫防除などの管理作業を行って野菜を育てる。1日の仕事は、朝の作業準備から始まり、その後、栽培作業、出荷、販売、あとかたづけをして夕方終了する。 ハウスには、パイプハウス、耐候性ハウス、ガラス温室等がある。ハウスの中の環境はコンピュータで自動制御されている場合が多いが、野菜の発育状況や品質を注意深く観察し、問題があるときには環境を調節し、肥料をやったり病害虫を取り除くなどの的確な対処が必要である。育てた野菜は収穫の際に形状や色彩、味などを見て、品質の悪いものを取り除き、出荷する。 ◇ よく使う道具、機材、情報技術等 農機具、トラクター、トラック、普通自動車、ボイラー、コンピュータ,入職にあたって、特に学歴や資格は必要とされない。高校、専門学校等で農業について学んだり、研修やセミナーなどで、土づくり、植物の生態、データに基づいた環境調節技術、経営等を学ぶと役に立つ。 畑を耕すトラクター、収穫物を運ぶトラック等を運転するので、普通自動車免許、大型特殊自動車免許等も必要である。ハウス栽培には、ボイラーの取り扱いもあり、ボイラー技士、危険物取扱者もあるとよい。 機械や身体を使っての反復作業が多いので、ある程度の体力が必要で、根気があり辛抱強いことも求められる。生物を育てることに興味と熱意があり、自然の中で働くことが好きな人に向いている。栽培する野菜の品質を高めるため、新たな栽培技術の導入や品種改良の情報を集める等技術習得に努める姿勢が大切である。また、栽培品目や栽培時期などを判断するために、消費者のニーズを的確につかむ情報収集も重要となる。自営の場合は、経営能力も必要となる。,ハウス野菜の栽培は全国各地で行われている。 ハウス野菜農家は、家族経営が中心の専業農家がほとんどであったが、雇用されて働いている人もいる。家族経営の場合でも、育苗、肥料やり、除草など一時的に作業が集中する時期には、パートタイマー、アルバイトを雇うのが一般的である。雇用される場合は、パートタイマー・アルバイトは時給制、正社員の場合は月給制であることが多く、シフト勤務になっていることもある。 自営の場合、高齢化が進んでいたり、個人の経営能力や技術水準によって収益に差がある。しかし、農業の中では、気象条件に左右されず計画的に栽培できることから、ハウス野菜は収益性の高い作物であり、機械化も進んでいる。最近では人員を投入して栽培品目、栽培量を拡大する経営農家が増えており、会社組織も出てきている。植物工場も含め高度な環境制御型の施設園芸への転換を進めつつ、規模拡大を図る動きもある。,https://shigoto.mhlw.go.jp/User/download,IPD_DL_description_7_01.csv,7.01,2026-06-04
JT0506,506,果樹栽培者,露地の果樹園やビニールハウス等の施設、観光果樹園などで、果物を生産する。,露地の果樹園やビニールハウス等の施設、観光果樹園などで、果物を生産する。 果物にはイチゴ、ブドウ、ナシ、リンゴ、ミカン、桃、サクランボ、柿、ブルーベリーなど様々な種類があり、それぞれに栽培方法が異なるが、開花時の結実管理、幼果時の摘果（てきか）、袋掛け、病害虫防除、土壌管理、収穫、出荷、貯蔵果実の管理、施肥（せひ）、整枝（せいし）・剪定（せんてい）、大型管理機械の保守点検、修理などが主な仕事となる。 このうち、開花時の結実管理、摘果、袋掛けは果樹栽培に特徴的な作業である。果樹の開花時には、受粉、受精がきちんと行われるよう、ミツバチやマメコバチなどの受粉媒介昆虫が働きやすい環境を整える。天候不良時には昆虫の働きが衰えるので、人工受粉を行って結実を確保する。次に、果実が小さいうちに樹についている葉数に合わせて「間引き」を行って果実の数を減らし（摘果）、残した果実が大きく育つようにする。果実が結実してきたら、ブドウ、ナシ、桃等品種により、保護のためにひとつひとつ手作業で袋掛けを行う。 そのほか、スプリンクラーなどを使って病害虫の防除を行ったり、果樹が養分を摂れるように草刈りや枝の剪定をする。また、直売所での販売やイベントでの販促活動などを行うこともある。 ◇ よく使う道具、機材、情報技術等 大型管理機械、スプリンクラー、普通自動車（普通免許（第一種、第二種）で運転可能なもの）,入職にあたって、特に学歴や資格は必要とされない。大学や高校等で果樹園芸を学んでいると役に立つ。 農業研修生として募集している農園で知識や実習を積み、就業する人も増えている。公的機関でも果樹栽培技術の研修を実施しているところがある。 経営者の場合は、果樹園の管理のほか、果物の販売戦略も考えなければならない。果樹は苗木の植付けから収穫まで数年を要するものも多いため、需要の動向を的確に予測する能力が必要とされる。品質向上のため、新たな栽培技術の習得に努め、品種改良に取り組む姿勢も求められる。 機械化が進んでいるが、摘果や袋掛け、収穫などでは手作業が必要であり、ある程度の体力が必要である。,果樹栽培は多くの場合、家族経営であるが、家族構成員の月給制や役割分担を明確にしている農家が増えている。また、法人化した組織が運営している場合もある。 常に栽培管理が必要となるが、年間の中でも作業の繁閑がある。 雇用労働者は正社員の他、特に収穫期においてはパートタイマーやアルバイトが必要とされる。正社員は月給制で、パートタイマー等は時給制が基本で、別途手当が付く場合もある。 個人の経営能力や品質のよい果物を作る技術水準によって、収益には差がある。 収穫した果実は、従来では農協などを通じて出荷するのがほとんどであったが、最近はお客にもぎとり体験をさせる観光果樹園や、宅配サービス、通信販売での直売などをしている果樹園も増えている。農家が直接販売する場合は、出荷する果実を選別したり、荷造り作業を行う必要がある。 また、輸出販路の拡大などの取り組みも活発化しており、産地ごとのブランド化や、収穫した果物を加工品として販売する、いわゆる「6次産業化」を行っている果樹園もある。,https://shigoto.mhlw.go.jp/User/download,IPD_DL_description_7_01.csv,7.01,2026-06-04
JT0507,507,花き栽培者,観賞用の花や観葉植物などの「花卉（き）」を生産する。,観賞用の花や観葉植物などの「花卉（き）」を生産する。花きは本来花と草の意味であるが、現在では観賞用の植物全般を指す言葉になっている。 花きには、切り花として出荷するもの（キク、バラ、カーネーションなど）、鉢に入れて出荷する鉢物（シクラメン、ラン、観葉植物など）、花壇用に苗物として出荷するもの（パンジーなど）、花木類（サツキ、ツツジなど）、球根を生産し出荷するもの（ユリ、チューリップなど）、芝や地被植物など多くの種類がある。品質による価格差が大きいため、生産者は品質を保つために細心の注意を払う。また、花きは、し好品であり、消費者の好みも様々で、中には、新しい品種を作り出すために、育種に取り組んでいる花き生産者や企業もある。出荷された花きは、流通を経て消費者に届けられる。野菜や果物と同様に、花きの流通は、卸売市場を経由する「市場流通」と卸売市場を経由しない「市場外流通」がある。市場流通が主となるが、近年は直売やインターネット取引などの流通の多様化により、市場外流通が増加傾向にある。また、花きの種類では、店舗で販売される家庭用の花き以外に、贈答や冠婚葬祭に使用される商業用の花きなどもある。 多品目の花きを組み合わせて生産することが多く、年間を通じて花きの成長段階に応じた作業がある。 花きの種類に応じて栽培技術を使い分け、ガラス温室やビニールハウスなどの施設、あるいは露地で生産する。 具体的な作業は、土作り、種まき又は苗の植えつけ、肥料の施用、水やり、薬剤の散布などによる病虫害の防除、温室の窓の開閉や冷暖房機の運転などによる温度管理、収穫作業、出荷作業などである。 管理が的確に行われなかった場合、美しい草姿や色合いにならず商品として販売できなかったり、需要期に合った出荷ができずに取引価格が低迷するので、きめ細かな管理が必要となる。 ◇ よく使う道具、機材、情報技術等 冷暖房機、農業機械、普通自動車（普通免許（第一種、第二種）で運転可能なもの）,入職にあたって、特に学歴や資格は必要とされない。以前は、農業系の高校や大学の農学部、園芸学部などで専門的な知識や技術を習得してから就業する人が多かったが、農業関係の知識がなくても、異業種から就業する社会人経験者も増えてきている。 花き栽培者の多くは自営で、親族のあとを継ぐケースが最も多く、米や野菜など他の作物を生産していた農家が新たに花きの栽培を行う場合もある。新規就農者の場合、研修生を受け入れている花き栽培農家などで実習生として技術を習得してから独立する場合が多い。 また、花きの生産・販売を行っている農業法人に就職し、栽培管理から出荷まで、生産における各工程の仕事の流れを学ぶ場合もある。比較的大きな規模の法人などでは、基本的な生産業務や生産管理業務を経験した後、営業や管理職になる場合もある。その後独立することも可能である。 就農相談に応える機関としては、「全国新規就農相談センター」があり、各都道府県にも同様のセンターがある。更に、技術習得への支援としては、都道府県の普及指導センターが就農前の研修場所の相談や斡旋をしている。未経験から始めた人や他業種から転身している人もいる。 花きは需要期を外すと販売価格が低迷するため、病害虫被害を受けないように注意しながら生育の状況を見守り、一番良いタイミングで消費者に届くよう調整を行っていく仕事であり、植物体の異変等を見逃さないように細かいところに注意を払いながら仕事を続けていくことができる人が向いている。流行や消費者のニーズを汲み取る感性も求められる。鉢ものやトレイ単位の苗を扱うこともあり、ある程度体力は必要である。 農業機械や車両等の運転をする必要があるため、普通自動車免許、大型特殊免許が必要な場合もある。,花きの主要産地は、愛知県、千葉県、福岡県、埼玉県、静岡県などである（2016年時点*1）。 花き栽培の労働時間は、季節や勤務形態によって異なる。繁忙期には朝早くに仕事を始め、夜遅くまで働くこともある。多くの女性が活躍している（*2）。パート、アルバイトの雇用も多い。 多くの生産者は、出荷グループや農協等に属して出荷している。 水やりやハウス内の温度管理などの環境制御は、自動的に行う装置が幅広く利用されている。また、急激な天候の変化には遠隔地からスマホやパソコンで制御することができる装置も開発されており、このような技術や計画的な栽培計画の検討により、休日の確保等労働条件も改善されてきている。 *1 農林水産省園芸作物課「平成28年花木生産状況調査」から *2 新潟農業大学校ホームページから,https://shigoto.mhlw.go.jp/User/download,IPD_DL_description_7_01.csv,7.01,2026-06-04
JT0508,508,畜産技術者,育種繁殖、飼養技術、牧草・飼料作物や畜産物の生産技術を開発したり、新しい技術や経営方法、環境対策等を畜産家に対して指導、普及する。,育種繁殖、飼養技術、牧草・飼料作物の生産技術や畜産物生産技術を実験、開発したり、新しい技術や経営方法、環境対策等を畜産家に対して指導、普及することである。 現在、我が国で畜産といっているのは、牛、馬、豚、ひつじ、やぎなどの家畜、鶏やあひるなどの家きん、ミンクやきつねなどの毛皮動物、蜜蜂の飼育、牧草や飼料用作物の生産・利用、牛乳・肉・卵などの加工と利用などであるが、畜産技術者はこれらの全てに通じているのはなく、それぞれ自分の専門とする対象や分野が決まっている。 畜産農家に対して直接技術援助を行う畜産技術者には、都道府県の普及指導事業に従事する普及指導員、農業協同組合職員の技術者などがおり、畜産農家に育種改良や飼育管理、飼料用作物の生産技術の研究開発などの成果を指導、普及させる。また民間企業には、乳業などの食品メーカー、飼料メーカー、製薬会社、商社などの技術社員として、自社商品の販売とアフターケアのために、畜産家の技術援助をする人たちがいる。 近年、バイオテクノロジーが急速に進展し、この関連技術が様々生まれ、畜産技術に取り入れられている。 ◇ よく使う道具、機材、情報技術等 普通自動車（普通免許（第一種、第二種）で運転可能なもの）,入職にあたって、専門課程をもつ学校を出て専門知識や技術を学ぶ必要がある。国・都道府県の試験研究機関や各都道府県の職員に就くためには、国や都道府県職員の試験に合格し、公務員になることが必要である。 公的な立場から生産者に技術指導を行う普及指導員になるには「農業改良助長法施行令」による資格試験に合格しなければならない。普及指導員の資格試験の受験には、大学卒業後4年（大学院修了後2年、短大卒後6年、高校卒後10年）以上の国、都道府県、農業協同組合等における試験研究、教育、普及指導の実務経験が必要となっている。 畜産技術者のうち、就職に有利な資格は、ふ化したばかりのひよこの雌雄を鑑別する「初生雛鑑別師」がある。独立して個人開業ができる資格としては、「家畜人工授精師」、「総括畜産コンサルタント」などがある。 動物と接することが多く、動物に関心があること、一定の体力が求められる。,主な就業場所は、家畜改良センターや地域農業改良普及指導センター、畜産試験場、農業協同組合、民間企業などである。 畜産技術者の労働条件は、都道府県の試験研究機関などで勤務する場合は、各自治体の規定による。メーカーなどの雇用労働者の場合は、正社員がほとんどで、労働時間や賃金は社内の規定による。農業協同組合や乳業、食肉、飼料関係のメーカーに勤務する場合で、動物を飼育しながら技術開発を行う職場や、家畜人工授精師などの資格を取って個人で開業する場合などは、労働時間が不規則になる場合もある。 動物にじかに接して行う仕事は、作業そのものは機械化されて最近は楽になっているが、動物の健康状態の観察を常に行って、異常の際はすぐ対応しなければならない。牛や馬、豚の分娩は時間が決まっていないので、深夜や夜明けに対応することもある。また、動物の飼育場所には冷暖房設備がなく、冬の早朝など厳しい自然環境の下で作業しなければならない。更に、地域住民との良い関係を保ち、糞尿処理などの環境整備を適切に行う必要もある。 規模の小さい畜産家の多い日本では、畜産製品の価格が輸入物に比べて高く、また、自由貿易協定（FTA）や新たな国際条約などの締結により、日本の畜産を取り巻く環境はより厳しくなる面がある。そのような状況下において、畜産に有益な技術開発を行い、それを普及する技術者への期待は高まっている。,https://shigoto.mhlw.go.jp/User/download,IPD_DL_description_7_01.csv,7.01,2026-06-04
