job_id,source_job_id,name,description_short,description,how_to_get,working_conditions,source_url,source_file,source_version,source_published_on
JT0001,1,豆腐製造、豆腐職人,豆腐店やメーカーの工場で、豆腐、油揚げ、生揚げ（厚揚げ）などを作る。,豆腐店やメーカーの工場で、豆腐、油揚げ、生揚げ（厚揚げ）などを作る。 豆腐を作るには、原料の大豆を前日にきれいに洗い、8～20時間ほど水につけておく。翌朝、水を吸って2～3倍の大きさになった大豆を、水を加えながら豆摺機（グラインダー）で摺り、ペースト状の生呉（なまご）にする。この生呉を十分煮込み、絞り機で豆乳とおからに分ける。 次に、豆乳の濃度と温度で凝固剤の「にがり」の量を判断して加え、機械か手作業で攪拌する。特に「絹ごし」の場合、攪拌は細心の注意が求められ、豆腐の出来栄えを大きく左右する。「木綿」では固めてから15分ほど熟成させた寄せ豆腐を、穴のあいた型箱に盛り込み、20～30kgの重石をのせて30分ほどプレスする。 最後に成形された豆腐を、冷水を張った水槽に移し、1丁ずつに切り分けて冷やす。 油揚げは、豆腐とは異なる工程で煮込みを行い、生地を作る。油揚げ生地は、薄く切ってスダレに並べてプレスし、１時間ほどかけて完全に水切りをした後、低温の油槽に入れて生地を十分にふくらませ、それを高温の油槽に移してカリッときつね色に揚げる。生揚げの場合は、豆腐の水分を十分に切った生地を200℃の高温で一気に1回で揚げる。 できあがった豆腐や油揚げ、生揚げなどは包装するなどして店頭で販売するか、卸し先に配達する。 ◇ よく使う道具、機材、情報技術等 豆摺機（グラインダー）、絞り機,入職にあたって、特に学歴や資格は必要とされない。特殊な技術を必要とするので、豆腐店で見習から始めて技術を習得し独立するか、家業を継ぐのが一般的である。 一通りの作業ができるまでに1～2年、季節による気温・水温の差に合わせた製造方法を体得し、店独自の「味」を維持するためのコツや勘を習得するには、4～5年の経験が必要となる。 独立・開業するには、店舗と製造設備、保管・販売設備などを揃えることが最低限必要になる。また、「食品衛生責任者」の資格の取得なども必要である。 また、力仕事が多いので、体力が求められる。,小規模な手造り豆腐店については、そのほとんどは夫婦や家族で製造し販売している。都市周辺部には、大手豆腐メーカーの工場があり、多くのパートタイマーが働いている。また、スーパーやデパートの中で製造販売するインショップ・ファクトリーもある。 豆腐は変質しやすく、また生で食べることの多い食品なので、衛生管理には十分な注意を払わなければならず、作業環境は清潔であるといえる。 従来は町の豆腐店は早朝作業というイメージであったが、機械化・省力化による製造時間の短縮などにより、労働時間の短縮が進んでいる。大規模工場では、二交替制の工場がある。 開業した場合、収入は売上次第だが、町の豆腐店では高齢化が進み、新規参入も少ないため減少傾向が続いており、豆腐メーカーの工場での量産が主流になっている。,https://shigoto.mhlw.go.jp/User/download,IPD_DL_description_7_01.csv,7.01,2026-06-04
JT0002,2,パン製造、パン職人,製パン工場や個人経営店（ホームベーカリー）でパンを製造する。,製パン工場や個人経営店（ホームベーカリー）でパンを製造する。 原材料の選択から焼き上げまでの全てを、一人から数人で行う小規模なベーカリーもあれば、一方では、自動化された生産ラインで100種類以上のパンを大量につくる大規模な工場もある。工場では仕事が分業化されており、生地をつくる仕事、成形の仕事、焼き上げの仕事に分かれる。 パン製造の仕事は朝が早い。小麦粉、イースト、塩、砂糖、油脂、粉乳、卵などの配合原料を、ミキサーと呼ばれる機械を使って混ぜ合わせ、練り上げて生地をつくる「仕込み」から始まる。次にパンに使うクリームを炊き上げたり、ジャムやあんの硬さを調節したり、レーズンのようなドライフルーツ類を細かく切るなど製造のために必要な準備をする。 仕込みが終わった生地の練り具合、硬さ、温度はパンの品質や出来映えに影響するので、細心の注意が求められる。生地を発酵させた後、一定量に分割し、手や機械を使ってパンの形を整える。成形した生地を型や鉄板の上に収め、一定の温度・湿度に保たれたホイロ（醗酵室）に入れて生地を膨脹させる。 パンの種類に応じてオーブンの温度、時間を設定し焼き上げるが、この工程での的確な調節によって、パンの焼色や香りが作り出される。焼き上げたパンは、網棚状のラックに並べ自然放冷した後、そのまま店頭に並べたり、食パンのようにスライス、包装などの加工をして販売する。機械化された工場では温度、湿度をコントロールした冷却工程によって冷却後、包装工程を経て出荷される。 ◇ よく使う道具、機材、情報技術等 ミキサー、オーブン、調理道具（包丁、ガスコンロ等）,入職にあたって、特に学歴や資格は必要とされないが、食品についての基礎的な知識を持っていることが望まれる。パンは種類によって原料配合や製造方法が異なるため、パンづくりの技術を習得するにはかなりの実務経験が必要となる。一般的にはパン製造の現場で経験を積んでいく。 機械化された大規模な製パン工場では、製パン工程が分業化されているケースもある。 一般的な製パン工場では入職後、原料の秤量などパン製造の準備工程を担当し、製造するパンの種類や製造の流れを覚えた後、成形や焼き上げの工程を担当して機械の操作を習得し、経験を積むとパンの品質にとって重要な仕込みの工程を担当するようになる。企業によって期間は異なるが、入職後6～7年程度で、本人の適性と能力により「班長・主任」などの現場の監督職に昇進する可能性がある。 また、専門学校などで指定された学科を卒業した人や2年以上実務を経験していれば、厚生労働省の定める技能検定の「パン製造技能士」の受験資格を得ることができ、キャリアアップする際に有利となる。 独立して開業する人もおり、パンを焼く小型のオーブンを設置し、焼きたてのパンを売る店が話題を集めることもある。また、独立開業する場合には、「食品衛生責任者」の資格の取得なども必要である。,ホームベーカリーやパン製造工場以外にも、菓子製造業や大きなホテル、デパート、スーパー等の中にパンをつくる部門を持っているところがある。 大規模な工場ではパン製造工程が細かく分けられるなど作業が単純化しており、パートタイマーも多い。 パンの製造は、仕込みから包装まで長時間かかるため、早朝から深夜までの作業が必要となる場合もあり、勤務は交替制を採ることもある。屋内での立ち作業が中心で、機械化の進んでいない小規模なベーカリーでは、パンを焼く作業では高温の環境で仕事をするなど、ある程度の体力が必要である。 大規模な製パン工場では機械化が進み、機械の監視作業などが中心となっている。小規模なベーカリーでは、洋菓子製造などと兼業し店の特色を出すケースもある。,https://shigoto.mhlw.go.jp/User/download,IPD_DL_description_7_01.csv,7.01,2026-06-04
JT0003,3,洋菓子製造、パティシエ,洋菓子店や菓子工場で洋菓子を製造する。,洋菓子店や菓子工場で洋菓子を製造する。また、レストランではデザートを担当し作った洋菓子を盛り付け客に提供する。 洋菓子は、大きく分けて、焼き上げたスポンジにクリームを塗ったりサンドした生菓子や、型に入れて焼き上げるが水分量の多いフルーツケーキのような半生菓子、クッキーのような焼き菓子、チョコレート製品、アイスクリーム、シャーベット等の氷菓に区分される。 洋菓子は種類によって作業内容が異なり、例えば生菓子では、まず卵、バター、砂糖、小麦粉を計量し、ミキサーなどの機械を使って混ぜ合わせ、ケーキの台となるカステラのような部分の生地づくりを行う。その後、専用の型に入れてオーブンで焼き上げ、クリームなどを塗ったり、絞ったりして形を整え、フルーツやナッツ、チョコレートなどを飾りつけて仕上げたりする。大型ミキサーや大きなオーブンを使用すれば生地は量産できるが、最後の仕上げは機械ではできないため、手作業で行う。通常、生菓子は冷凍技術の進歩によりストックも可能であるが、基本的には、その日の午前中に仕上げてその日のうちに売り切るようにする。 洋菓子店の場合は手造りの作業が中心となるが、菓子工場のラインで働く場合は機械の操作や監視が中心となる。レストランでは客の注文に応じ、様々な種類の洋菓子を美しく盛り付け客に提供する。工場生産の場合でも、洋菓子店と同じ菓子を見本にして製造するため、洋菓子職人の技術、創造性、センスが製品の出来に影響する。 ◇ よく使う道具、機材、情報技術等 調理道具（包丁、ガスコンロ等）,入職先によって資格や学歴が必要とされない場合もあるが、現在は高校を卒業後、菓子・調理系の専門学校で基礎知識を身につけてから入職するケースや、大卒の入職者もみられる。専門学校では洋菓子作りの技術や知識だけでなく、食品や栄養に関する知識、衛生法規なども学ぶ。 入職後は、店の規模などによって差はあるが、一つの製造工程を受け持ち、ある期間経験を積むと次の工程に移るというようにして、数年で一通りの技術が習得できると言われている。 様々な種類の菓子作りを習得するために、フランス等の海外も選択肢に、いくつかの店に勤務して自分の技術を向上させる人も多く、また、何年か働いてから独立して自分の店を開く人もいる。 関連する資格として、厚生労働省の定める「製菓衛生師」や技能検定の「菓子製造技能士」があり、入職後に一定の実務経験を積み、学科及び実技試験に合格すると取得できる。製菓衛生師の有資格者は食品衛生協会主催の講習会を受講しなくても食品衛生責任者になることができる。 味覚が鋭いこと、デザイン、色彩、装飾などの美的感覚を持っていることが求められる。,洋菓子店は洋菓子専門店のほかに、和菓子やパンの販売と兼業する店や、喫茶コーナーなどを併設する店もある。従業員が少ない中小の店が多いが、従業員100人以上の企業もある。洋菓子店、レストランの就業者は以前は男性が多かったが、最近では女性が増えている。 労働時間は、原則として勤務先の規定によるが、仕込みのため早朝から仕事を始める場合があり、そのような店では交替制を採用していることもある。レストランでは職場の規模によるが、デザートだけでなく他の調理の補助等も行う場合もある。10月頃からクリスマス、年末年始、バレンタインデーを過ぎて3月頃までは洋菓子がよく売れる時期で注文が多いため、残業が生じたり、休みがあまり取れないこともある。一方で夏季は比較的売れ行きが少ないため、店によっては長期の休暇を設けているところもある。,https://shigoto.mhlw.go.jp/User/download,IPD_DL_description_7_01.csv,7.01,2026-06-04
JT0004,4,和菓子製造、和菓子職人,和菓子店で各種の和菓子を製造する。,和菓子店で各種の和菓子を製造する。 和菓子の種類は、含まれる水分量によって、「生菓子」と「半生菓子」、「干菓子」に分けられる。「生菓子」には、大福やおはぎなどの餅もの、まんじゅうなどの蒸し物、ぎゅうひなどの練り物、どら焼きやカステラなどの焼き物（平鍋物）など、「半生菓子」には、石衣などのあん物、最中などのおか物、桃山などの焼き物、羊かんなどの流し物がある。また、「干菓子」には、落がんなどの打ち物、塩がまなどの押し物、おこしなどの掛け物、小麦せんべいなどの焼き物、有平糖などのあめ物がある。 和菓子の代表である「まんじゅう」を作る場合は、まず材料選びから始める。製品の風味やよしあしは、材料の影響を大きく受ける。あんを作るには、材料となる小豆などをよく洗ってから水で炊き、柔らかくなってから砂糖など甘味料を加えて練る。できあがったあんを、米の粉や小麦粉、山芋などで作った生地に包み込んで形を作り、焼いたり蒸したりして仕上げる。あんにごまやみそを使ったり、生地にきな粉を使ったりなど、材料を変えることによって、いくつもの種類のまんじゅうを作り分けることができる。 和菓子の中には大規模な工場の機械化された設備の中で生産されているものもある。しかし、多くの和菓子店ではその営業規模に応じて機械を導入するとともに手造りのよさを生かして製造しており、製品の仕上げでは職人の技術、感性、創造性などが重要となる。 ◇ よく使う道具、機材、情報技術等 調理道具（包丁、ガスコンロ等）,入職にあたって、特に学歴や資格は必要とされない。ただ、製菓系の専門学校のなかには和菓子のコースがあるところもあり、学校で学んでから入職するケースもある。 和菓子職人となる上で、大切なことは和菓子を作る技術を習得することだが、和菓子は種類が多いため、多くの経験を積んで技能を身につけることが必要となる。 取得すると有利な資格として厚生労働省の「製菓衛生師」や「菓子製造技能士」がある。製菓衛生師の有資格者は食品衛生協会主催の講習会を受講しなくても食品衛生責任者になることができる。 また、食品衛生に関する知識、原材料の特性やその生かし方、製菓理論、販売との関わり、経営的知識などが必要とされる。 和菓子に興味を持つことはもちろん、味覚を知る、デザイン、色彩、装飾など美的感覚を磨くことも必要で、常に幅広い知識の吸収に力を注ぐことが大切である。 経験を積んでいく中で責任者や工場長という指導的立場になっていくが、独立開業を目指す場合には、何軒かの店を経験して多様な技術習得を行う場合もある。,和菓子製造企業（店舗）は、歴史がある業界だけに全国各地に分布しており、就業地は全国に及ぶ。大・中規模企業もあるが、多くは小規模経営である。商品の種類が多いため経営形態は多様で、手づくりの生菓子中心の店、日持ちする焼菓子や羊かんを中心に扱うチェーン店、洋菓子も販売する店、甘味など喫茶を併設する店などがある。 労働条件、休日、給与などは勤務する企業や店舗により大きく異なる。労働時間は、基本的には9時～17時までであるが、早朝に仕込みを行う場合もあり、そうした場合は交替制などが採用されていることが多い。また、繁忙期や注文の多いときには残業もある。 和菓子は季節との関係が深く、年中行事や地域習慣と密着していること、植物性の材料を使った健康的な菓子であることなどから、日本人の食生活の中に定着しており、今後も一定の需要があるものと見込まれる。,https://shigoto.mhlw.go.jp/User/download,IPD_DL_description_7_01.csv,7.01,2026-06-04
JT0005,5,乳製品製造,牛乳、ヨーグルト、バター、チーズなどの乳製品を製造する。,牛乳、ヨーグルト、バター、チーズなどの乳製品を製造する。 乳製品の製造工場には、飲用牛乳、ヨーグルト、乳酸菌飲料、乳飲料などを製造している飲用牛乳工場や、アイスクリーム工場、更に、牛乳（生乳）を原料として加工したチーズやバター、練乳、粉乳などを製造している乳製品工場などがある。仕事内容は、製造する乳製品の種類や配属される工程によって様々である。 飲用牛乳の製造では、乳牛からしぼった生乳を検査し、脂肪の粒を均質化してから殺菌冷却し、紙容器やビンに包装する。ヨーグルトや乳酸菌飲料水を製造する場合は、牛乳の製造工程に加えて、生乳に砂糖や香料を調合したり、乳酸菌を加えて発酵・凝固させたりする工程がある。 代表的な乳製品であるチーズのうち、ナチュラルチーズは、原料乳を検査、加熱殺菌し、牛乳に乳酸菌や酵素を加えて固め、水分を除去して様々な形の型に詰めて圧縮し、塩水に漬け、発酵熟成させる、といった工程で製造される。一方、プロセスチーズは、原料チーズの検査、原料配合、加熱溶融（乳化・殺菌）、包装、冷却、検査といった工程を経て製造される。 乳製品では機械化された生産ラインで製造されるのが一般的である。 ◇ よく使う道具、機材、情報技術等 コンピュータ、各種製造機械,入職にあたって、特に学歴や資格は必要とされない。学歴は高卒以上が一般的で、普通高校の他に、農業高校を卒業した人もいる。 入職後は、研修で製品の基礎知識などを習得し、実習を受けた後、工場に配属されるのが一般的である。その後は、上司や先輩の指導を受けながら、主にOJTによって知識、技術を習得していく。 牛乳・乳製品に対する品質管理や衛生管理は厳しく行われており、原料の受入れから最後の製品の出来上がりまでの各製造工程で、製品のチェックの他に、日付表示や異物混入などの検査が行われている。出来上がった製品に対しては、抜き取り検査をして、保存試験や各種の検査項目に基づき、風味、成分、組織、細菌などのチェックが行われる。関連する資格として「食品衛生管理者」があるが、乳製品を製造・加工する施設では衛生管理のため食品衛生管理者を必ず置かなければならない。,乳製品工場は原料の生乳を生産する酪農が盛んな地域に多く、飲用牛乳工場は新鮮な製品を供給するために大都市近隣に立地している他、牛乳の生産地にも立地している。企業経営のほか、農協が経営している場合や、酪農家が個人経営で乳製品の製造も行っている場合がある。大規模工場の場合、パートタイマーも多い。 勤務時間は担当する工程によって交替制勤務や早出・遅出やローテーションを組んで休日や休暇を取るなど勤務形態が異なる。また、夏から秋にかけては季節的に需要が多いため、勤務体制の変更や残業が生じる場合もある。 大規模工場ではコンピュータ制御による生産ラインの自動化が進んでおり、機械の操作・監視などが主な仕事となっている。多品種少量生産の場合は、まだ製造工程の一部で手作業の仕事がある。,https://shigoto.mhlw.go.jp/User/download,IPD_DL_description_7_01.csv,7.01,2026-06-04
JT0006,6,水産ねり製品製造,かまぼこやちくわ等の水産ねり製品を製造する。,水産ねり製品を製造する。 水産ねり製品には、板付きかまぼこ、ちくわ、揚げかまぼこ、はんぺんやつみれなどのゆでかまぼこ、カニかまぼこやオードブルかまぼこなど様々な種類がある。製造工程は、魚肉の精製、らいかい、成形、加熱・冷却、包装、貯蔵・出荷に大別される。 精製作業は生鮮魚から頭、内蔵などを取り除き肉を分離し、水晒し、脱水を行い不要な成分を取り除き魚肉を精製する。冷凍すり身は、この精製作業ののちに冷凍したものである。製品の製造には、通常、冷凍すり身が使用される。 解凍した冷凍すり身や精製魚肉に食塩などを加えてすりつぶすらいかい作業は空ずり、塩ずり、本ずりに分かれている。いずれも原料をかくはん機でかきまぜる。空ずりでは、塩ずりの効率をよくするために魚肉の繊維を細かくし、塩ずりでは、食塩を添加してかまぼこ特有の弾力の基となるたん白質を抽出する。本ずりは仕上げずりともいわれ、調味料、でんぷんや水などを加えて味や弾力を整える。らいかい作業は、かまぼこの品質を決める重要な要素の一つであり、熟練工の監督の下に行われる。 成形作業では、成形機を使用して、板付け、ちくわ型などそれぞれのかまぼこの形に成形する。 加熱作業では、加熱機械を操作して、商品の形態ごとに焼き、蒸し、揚げ、ゆでなどを行う。加熱作業はらいかい作業と同様にかまぼこの品質を決める重要な要素の一つである。包装作業では、製品として出荷するため加熱冷却した後、包装機で商品を包装する。貯蔵・出荷作業では、完成した製品を冷蔵庫に保存し、注文により箱詰して出荷する。 ◇ よく使う道具、機材、情報技術等 成形機、加熱機械、製造機械,入職にあたって、特に学歴や資格は必要とされない。新卒者の採用では、高校の水産系・工業系・普通科、大学の食品加工関係学科や水産学部、短大の調理・栄養学科、専門学校の出身者が多い。入職経路は、新卒の場合は学校からの紹介、中途採用の場合は、ハローワークと求人広告がほとんどである。 採用後に行われる研修内容は、一般的な知識や専門知識に関する研修、製造工程全般についての現場研修などがある。事業所によっては、営業などの経験を経てから、水産ねり製品製造の現場等本人の能力に適した部署に配属されるケースもある。 魚種や漁獲方法など原料魚に関する基礎知識や、製造機械に関する知識、食品衛生に関する知識などを習得する必要がある。 関連資格として厚生労働省の定める技能検定の「水産練り製品製造技能士」がある。,水産ねり製品を製造する工場は沿岸部を中心に分布している。その多くは中小企業である。労働時間は1日8時間が標準であるが、春・秋の婚礼シーズンや年末などかまぼこ需要の多い時期には残業をする場合がある。梅雨期など需要の閑散期には、勤務時間が短くなることもある。 水を多く使う関係から冬期の作業環境は他の食品加工関係の作業場に比べると厳しいといえる。 小規模の工場では、原料のすりつぶしから包装までの製造作業を1人で行うこともあるが、通常は工程別にその担当者が作業している。大企業では、製造機械の一部をコンピュータで制御するなど製造工程の自動化が進められている。,https://shigoto.mhlw.go.jp/User/download,IPD_DL_description_7_01.csv,7.01,2026-06-04
