job_id,source_job_id,name,description_short,description,how_to_get,working_conditions,source_url,source_file,source_version,source_published_on
JT0328,328,動画制作,動画を撮影し作品として制作する。,動画を撮影し作品として制作する。この制作には2つのパターンがある。一つは自らテーマを決めて動画を撮影し、動画共有サイトにアップするものである。もう一つはクライアントの依頼に基づき動画を制作するものである。 動画共有サイトにアップする場合は、できるだけ多くの視聴者に視聴して貰うために、独自性に富んだ、興味深く、関心を惹く動画を制作することが重要である。ユニークな企画を立て、撮影方法や編集を工夫し、他にないような作品にすることが求められる。アップした動画の再生回数が少ない場合でも、動画をコンスタントに制作しアップし続けることで、視聴者の増加に繋がることもある。 動画制作に必要な機材には、パソコンや撮影用カメラ、編集用・加工用ソフトなどが挙げられる。最近では、スマートフォンが高性能になり、簡易な動画であればこれ１台で撮影、加工、アップまでできる。質の高い動画を制作するためには、これらの機材以上に動画制作のセンスと技術が求められる。投稿する動画がゲームの実況であれば、ゲームに関するルールや知識を基に、意外性があり、視聴者がワクワクするようなトークや編集を心がけなくてはならない。また、再生回数が伸びるよう、SNSやブログなどでも発信し、視聴増加につなげるようにする。 クライアントから発注を受けて動画を制作する場合を、仕事の流れに沿ってみると、まず、クライアントや広告会社と打合せ、契約を交わす。キックオフミーティング等でクリエーターも交えて、クライアントのニーズを把握し、企画を作る。企画が固まったら、シナリオを作成し、クライアントに提案して、合意を得る。その後、動画の撮影、編集、ナレーションの収録を行って、動画として仕上げ、クライアントのチェックを受ける。必要であれば、調整、修正等を行い、作品として完成させ、納入する、という流れになる。 ◇ よく使う道具、機材、情報技術等 撮影用カメラ、スマートフォン、画像等編集ソフト（Photoshop、GIMP等）、パソコン,クライアントから発注を受ける動画制作には、特に学歴や資格は求められないが、多くの場合、映像系の学校を卒業し、映像制作会社に入る。その映像制作会社で経験を積み、独立するという例が多い。最近では、学生のうちから動画制作の経験を重ね、そのままプロを目指すという道もある。ただし、独立したり、フリーランスとなる場合は、映像の技術とともに、業界関係者と幅広いつながりを持つことが仕事をする上では重要である。 クライアント、広告会社等関係者と十分なコミュニケーションをとり、クライアントの要望をよく理解し、期待に応える技術力、納期までに仕上げる責任感が必要である。時流が分る感性や制作に対する熱意、満足できるまで制作を続ける根気も重要である。外国語の動画は増えているが、翻訳は外注してしまうため、制作自体には語学は必ずしも求められない。 一人前となるには、経験年数だけでなく、感性やセンスがクライアントなど業界に認められ、コンスタントな受注件数を確保し、条件の良い仕事を受注できることが必要である。 動画共有サイトで広告収入を得るには、総再生時間や視聴者数の基準に基づいた審査を受けて、認められることが必要なところもある。 技術面、機材等で動画制作者を支援し、仕事を仲介したり、その人が動画共有サイトで人気が出るようにする会社も出てきている。,クライアントから発注を受ける動画制作の場合、クライアントや広告会社は大都市に集中しているため、多くはその周辺に集まっている。地方で活動している場合は、通常は関係者とはメールやビデオ会議で対応し、必要があれば出向いて、打合せや会議を行っている。 映像制作会社で雇用され、就業している者もいるが、フリーランスで活動している者も多い。副業として動画制作をしている人もいる。フリーランスの場合、収入の変動が大きく、個人差も大きい。仕事の繁閑も個人差が大きい。 動画制作者としてサイトに登録し、仕事を受注する方法も出てきている。 マーケティングに影響力のある動画制作のインフルエンサーは広告業界も注目している。中にはタレントのような活動をする人も出てきている。若者を中心に、テレビを見ないで、ネットで動画を視聴するようになっている今日、動画制作は新たな仕事、新たな収入を得る手段の一つとして、広がっていくと考えられる。,https://shigoto.mhlw.go.jp/User/download,IPD_DL_description_7_01.csv,7.01,2026-06-04
JT0329,329,CG制作,コンピュータのグラフィックス機能を用いて、CGによる静止画や動画を作成する。,コンピュータで図形、絵、映像、アニメーションなどのコンピュータグラフィック（CG）を制作する。CGクリエイターと呼ばれることもある。 近年CGは長足の進歩を遂げ、テレビ番組や映画、アニメ、ゲーム、広告、ステージ等の背景から機械や建築の設計、医療に至るまで様々な分野で活用されている。 CGには「2次元」（2D）と「3次元」（3D）があり、2次元は平面で奥行き情報がなく、3次元には奥行き情報があり、現実の空間のようなリアルな映像表現ができる。3D CGは外科手術の医療シミュレーター、航空機や電車の操縦などの訓練用シミュレーター、機械や建築のデザインなど、多方面に使われている。 CG制作では専用のソフトウェアを使用する。3D CGは次のような一連の工程で作成される。仮想の3次元空間の中でCGによるモデル（立体形状）を作成し（モデリング）、モデルに質感をあたえ（マテリアル設定）、骨格や構造等仕組みの技術的な設定を行い（リギング）、モデルに動きを付ける（アニメーション付け）。そして、モデルをシーン内に配置し、カメラとライト（光源）を設定し（シーン構築）、爆発などの映像効果を加え（エフェクト）、仮想の3次元空間内に設定されたモデル、カメラ、ライトなどの情報から画面を生成する（レンダリング）。このように作られた画面を合成しCGとして完成する（コンポジット）。 媒体がWebサイト、デジタルサイネージ、広告、ポスター等、平面の場合、また、スマホ等軽量な画面が求められる場合は2D CGが利用される。2D CGでは、コンセプトを決め、ラフなスケッチを描き、線画を作成し、色付け等を行い仕上げる。Webサイトやスマホではユーザーインターフェースに配慮する。Webデザイナー、Webディレクターと共同で制作し、主に画面の一部、アイコンやパーツを担当する場合もある。広告、ポスターではどのようにアピールするか考える。広告ディレクター、広告デザイナーと制作する場合もある。 簡単なスマホ画面などの場合は、全ての工程を1人のCG制作者が担当する場合もあるが、映画や大作ゲームなどきめ細かな画面、高度な技術をふんだんに取り込んだCGを制作する場合は、多くのCG制作者が分業して作成する。 ＜就業希望者へのメッセージ＞ 自分が制作した作品が広く世の中に発信されることが魅力です。締め切りのある仕事のため、忙しい時期には勤務時間が長くなることもあります。その一方で、基本的には勤務時間や働く場所を選択でき、働き方も多様なので、たとえば子育てや介護と両立できる職場をみつけることもできると思います。（就業者） ◇よく使う道具、機材、情報技術等 CG制作ソフト、3D CG制作ソフト、イラスト・デザイン作成ソフト（Illustrator、Clip Studio等）、画像編集ソフト（Photoshop、GIMP等）、動画編集ソフト、パソコン,入職にあたって、特に学歴や資格は必要とされないが、興味を持ち動画や教則本でスキルを身につけて応募する人が多い。造形力やセンスが重視されるため、大学や専門学校などでデザインを勉強していたり、CGの知識や経験がある人が多くなっている。 中途採用ではCG制作の経験者が求められる。 Webブラウザやスマートフォン用の簡易なCG制作と、映画や大作ゲームのCG制作とでは、求められる能力が異なる。前者の場合、様々な役割を1人でこなせるジェネラリストが求められ、後者の場合は仕事の分業化が進んでいるため、1つの役割に特化したスペシャリストが必要とされる。例えばモデリングのスペシャリストは造形力が重視され、アニメーションのスペシャリストは演技や演出の技術が重視される。ただし、集団作業を円滑に行うためには、担当以外の作業に関する知識も積極的に吸収しようとする姿勢が大切である。チームによる制作ではコミュニケーション能力や協調性が重視される。長時間におよぶ地道な作業が多く、根気強さも必要である。日ごろから映画やゲームなどのCG作品を鑑賞し、センスや技術を磨くことも重要である。,勤務先は、映像制作会社、デザイン事務所、広告制作会社等のCG制作スタジオであり、職場は東京等都市部が多い。フリーランスで仕事をしている人もいる。就業者は比較的若い人が多い。 企業で雇用される場合は、賃金、労働時間等労働条件は勤務先の規定による。経験や能力が評価されて、賃金等に反映される。自分一人で担当部分の作業を行うことが多く、労働時間や休日は比較的自由な体制をとっている職場が多い。ただし、締め切りが迫ると、残業や土日祝日に仕事をすることもある。 CGの技術は年々高度になっており、高い技術とセンスのあるCG制作者が求められている。一定レベルのCGは生成AIで作れるようになり、初歩的な仕事、入門的な仕事は置き換えられることもみられる。また、制作体制の国際化も進行しており、中国、韓国、インドネシア等、東南アジアの制作会社と協力して作成したり、欧米の会社から制作を依頼されることも多い。,https://shigoto.mhlw.go.jp/User/download,IPD_DL_description_7_01.csv,7.01,2026-06-04
JT0330,330,ゲームクリエーター,スマートフォン、家庭用ゲーム機、パソコン等のゲームソフト（アプリ）を制作する。,スマートフォン、家庭用ゲーム機、パソコン等のゲームソフト（アプリ）を制作する。 ゲームソフトは、一般的にいくつかの専門的な技術や能力を持つ人がチームを組んで制作する。ゲームクリエーターの肩書きや人員構成は各ゲームソフト開発会社ごとに異なるが、多くは次の４つの担当に分けられる。 「企画担当」は、ゲームの構成やシナリオを作成する。ゲーム全体の流れをつかみながら、状況やセリフなどの設定を考える。 「グラフィック担当」は、ゲームに必要なキャラクターやアイテム、背景などを作成し、それをCG（コンピュータグラフィックス）画像として仕上げる。有名漫画家やイラストレーターにキャラクター等のデザインを依頼することもあるが、その場合でも、この担当者がCGによるさまざまなバリエーション画像を作成する。 「プログラミング担当」は、キャラクターの動きやゲームの進展を、コンピュータ言語によって作成する。 「サウンド担当」は、ゲームで使われる音楽や効果音を作る。 このような担当に分かれて作業を分担し、打ち合わせを行い、協力しながらゲームソフトを作成する。企画担当は、人員の調達、予算やスケジュールの管理をする場合もある。また、モニターによる評価・意見に基づいて内容の修正を行う。 ◇ よく使う道具、機材、情報技術等 コンピュータ言語、画像等編集ソフト（Photoshop、GIMP等）、パソコン、スマートフォン、家庭用ゲーム機,入職にあたって、特に学歴や資格は必要とされない。「グラフィック担当」には絵やデッサン、描画能力が必要で、美術系の大学や専門学校卒業者が多い。「サウンド担当」は音楽の知識が必要で、音楽大学や専門学校卒業者が多い。 ゲームソフト開発会社やゲーム機を開発する会社に入社する。入社後、すぐに責任のある仕事が任せられることはなく、各担当のアシスタントを２～３年しながら、現場でスキルやノウハウを習得していく。その後、実績に応じて、重要な仕事を任されるようになる。 「企画担当」には豊かな発想力と緻密さ、「プログラム担当」にはコンピュータ言語によるプログラミングの技術、「グラフィック担当」には絵やデッサン、描画の能力、「サウンド担当」には音楽のスキルと感性が求められる。また、どの担当でも、新しいもの、面白そうなものに対して敏感に反応する感性や探究心も重要となる。,勤務先は、ゲームソフト開発会社やゲーム機を開発する会社であり、職場は都市部に多い。 就業者は若年層が多く、特にグラフィックやサウンドの担当者には女性も多い。 賃金、労働時間等労働条件は勤務先の規定による。フレックスタイム制での勤務が多い。制作の追い込み段階では、夜間の作業や残業が増えることもある。個人の成果によって収入に差が生じる場合もある。ヒット作を担当したスタッフに対しては報奨金等の制度を設けているところが多い。 スマートフォンでのゲームが普及し、パソコンやゲーム機もますます高性能になっている。また、ゲームの市場は拡大しており、日本のゲームは輸出品の一つとしても期待されており、ゲームクリエーターの需要は大きい。,https://shigoto.mhlw.go.jp/User/download,IPD_DL_description_7_01.csv,7.01,2026-06-04
JT0331,331,アートディレクター,広告などを制作するにあたり、ビジュアルデザインを中心にとりまとめを行う。,広告などを制作するにあたり、ビジュアルデザインを中心にとりまとめを行う。 街頭や電車内のポスター、新聞・雑誌の広告ページ、Webサイト、チラシなどの媒体を使って、情報をいかに分かりやすく効果的に伝えるかを考え、企画から印刷、またサイト掲載までの作業を取りまとめる。 テレビCMやWebサイト全体等、広告全体を指揮する人を広告ディレクター（クリエイティブディレクター）といい、その下でビジュアルデザインのとりまとめをする人がアートディレクターである。 まず発注者の意向に応じて、デザイナー、イラストレーター、カメラマンなどのスタッフを選び、媒体、内容、表現方法などを企画・立案し、発注者にプレゼンテーションして了解を得る。 企画決定後は、撮影に立ち会ったり、デザインの修正指示などをしながら、完成までまとめ役をする。テレビのコマーシャルなど映像媒体で仕事をする場合もある。紙媒体の場合は、作成した原稿等をデータで印刷会社に渡し、印刷方法や注意点を指示する。校正を行い、発注者のチェックを受け、必要であれば修正し、印刷、納品する。Webサイトの場合は画面として作成し、発注者のチェックを受け、必要であれば修正し、納品する。 ◇ よく使う道具、機材、情報技術等 イラスト、デザイン作成ソフト（Illustrator、Clip Studio等）、画像等編集ソフト（Photoshop、GIMP等）、パソコン,入職にあたって、特に資格は必要とされないが、デザインの知識と経験が不可欠となる。ほとんどの場合、大学や専門学校等で基本的な技術や手法を学び、広告制作会社などでデザイナーとしての経験を積み、アートディレクターとして活動する。 フリーのアートディレクターとして独立する人もいる。 デザイン能力に加えて、新しいアイディアを生み出す企画・表現力、多くのスタッフに適切な指示を与える能力、予算やスケジュールの管理能力、発注者に対するプレゼンテーション能力などが必要になる。また、時代の変化をとらえる力や人々の心をとらえるビジュアルを作り出す表現力が求められる。,勤務先は広告制作会社、デザイン事務所等であり、職場は広告、出版の仕事が集中する大都市が多い。独立してフリーランスで活動している場合もある。数百人のスタッフを抱えている大規模の会社から、ディレクターのほか数名のデザイナーで運営されているデザイン事務所まで様々である。規模の大きい会社ではデザインチームのリーダーとして働いているのに対し、フリーランスの場合はデザイナーやイラストレーターを兼ねていることが多い。 就業者は男性が多いが、女性も増えている。 受注から納品までのスケジュールがまちまちで、納期に追われることも多いため、勤務時間は不規則になりがちである。 時代の変化に合わせて人々のニーズを的確に捉えることが求められており、ビジュアルデザインの方向性を統括する仕事の役割が重要となっている。,https://shigoto.mhlw.go.jp/User/download,IPD_DL_description_7_01.csv,7.01,2026-06-04
JT0332,332,広告デザイナー,広告会社等において、テレビCMやポスター、新聞や雑誌、Webなど様々な媒体の広告のデザインを行う。,広告会社等において、テレビCMやポスター、新聞や雑誌、Webなど様々な媒体の広告のデザインを行う。広告デザインの一部として、新商品や製品パッケージのデザインを行うこともある。 仕事の流れとしては、まず、広告主と打合せをし、意図や要望などを把握する。これをもとに大まかなスケッチ等を描く。広告の文章であるコピーとともにラフ案をまとめ、広告主に提案する。提案が承認されたら、イラストや写真を必要に応じて外部に発注するなどして作成し、コピーと合わせて広告を完成させる。 広告の仕事はチームで行うことが多い。広告デザイナーはコピーライターやCMの企画や内容を考えるCMプランナーなどで構成されるチームに配属される。チームリーダーである広告ディレクターやデザイナーのまとめ役であるアートディレクターの下で仕事を進める。 通常、広告デザイナーは数年の経験を経てアートディレクターに昇進するが、制作会社のデザイナーへの指示を行うため、広告会社によっては入社直後の広告デザイナーが、アートディレクターという肩書を名乗ることもある。 広告デザインの分野においては、グラフィックデザインと動画のデザインの境目がなくなりつつある。Webデザインなどの領域に幅を広げるデザイナーも増えている。広告デザイナーの仕事の領域は広がっている。 ◇ よく使う道具、機材、情報技術等 画像等編集ソフト（Photoshop、GIMP等）、パソコン,入職にあたって、特に学歴や資格は必要とされないが、新卒で広告デザイナーとして就職するには、4年制の美術系大学や専門学校等を卒業している場合が多い。中途採用の場合は実務経験が重視される。 採用に際しては、デザインができることに加えて、広告に関する知識やコミュニケーション能力、プレゼンテーション能力が備わっていることが求められる。ほとんどのデザイン作業はパソコンを使って行われるので、パソコンでデザインをするスキルも必要とされる。 広告デザイナーとしての経験を積み、アートディレクターや広告ディレクターへ昇進していく。コピーの書き方を勉強して、CMプランナーなどへ転身する例もある。また、独立して自分のデザイン事務所を持つ人もいる。 デザイン能力に加えて、新しいアイディアを生み出す企画・表現力、発注者に対するプレゼンテーション能力などが必要になる。また、時代の変化をとらえる力や人々の心をとらえるビジュアルを作り出す表現力が求められる。,勤務先は、広告会社等であり、企業の数が多い都市部に集中している。特に、テレビなどのマスメディアに広告を出す企業は本社機能が東京に集中している。日本の広告会社は7千社ほどあるが、上位10社で売上のシェアは約3分の2を占めている（*）。 就業者は、正社員の他、有期の契約社員、フリーランスで働く人もいる。 雇用労働者の場合は、賃金、労働時間等労働条件は勤務先の規定による。勤務時間はフレックスタイム制が多い。納期が近いと、残業時間が増えることがある。 正社員の場合は、基本的には月給制であり、業績評価が賃金に反映されることが多い。 *経済産業省 平成30年特定サービス産業実態調査報告書（広告業編）から,https://shigoto.mhlw.go.jp/User/download,IPD_DL_description_7_01.csv,7.01,2026-06-04
